{
  "wifi_ssid": "HomeWiFi",
  "ota_host": "ambilight",
  "ip_octet": 245,
  "num_leds": 32,
  "max_leds": 1500,
  "brightness": 100,
  "color": "#ffffff",
  "led_mode": 1,
  "led_top": 10,
  "led_right": 6,
  "led_bottom": 10,
  "led_left": 6,
  "start_corner": 0,
  "clockwise": true,
  "gamma": 2.2,
  "saturation": 1,
  "smoothing_ms": 200,
  "wb_r": 255,
  "wb_g": 255,
  "wb_b": 255,
  "power_limit_w": 0,
  "pixel_watts": 0.72,
  "power": true
}
